date:iso,datetime:iso,datetime:rss,datetime:unix,description,feature_image,feature_image:height,feature_image:width,id,label,month:iso,source,tags,title
2013-12-19,2013-12-19T13:30:00+00:00,"Thu, 19 Dec 2013 13:30:00 GMT",1387459800,The spoon and fork handle can detach.,http://www.cpsc.gov/Global/Images/Recall/2014/14070/SMALL_Cubetensils%20together.jpg,63,87,7aff55e2a74ef03fa88047afa6abacb17c2c894d,Cubetensils Children's Eating Utensils Recalled by Edoche Due to Choking Hazard,2013-12,http://www.cpsc.gov/en/Recalls/2014/Cubetensils-Childrens-Eating-Utensils-Recalled-by-Edoche/,"[u'children', u'choking', u'hazard']",Cubetensils Children's Eating Utensils Recalled by Edoche Due to Choking Hazard
2013-12-19,2013-12-19T11:00:00+00:00,"Thu, 19 Dec 2013 11:00:00 GMT",1387450800,The buckles on the infant carrier straps can crack or break and an baby can fall.,http://www.cpsc.gov/Global/Images/Recall/2014/14069/Model05301133x97.jpg,63,87,531cf64b6a77bae388806df1d68cf649476b1a8e,Playtex Recalls Hip Hammock Infant Carriers Due to Fall Hazard ,2013-12,http://www.cpsc.gov/en/Recalls/2014/Playtex-Recalls-Hip-Hammock-Infant-Carriers/,"[u'infant', u'hazard', u'fall']",Playtex Recalls Hip Hammock Infant Carriers Due to Fall Hazard 
2013-12-19,2013-12-19T10:00:00+00:00,"Thu, 19 Dec 2013 10:00:00 GMT",1387447200,The hoodies were sold with drawstrings through the hood or neck. These drawstrings pose a hazard to young children.,http://www.cpsc.gov/Global/Images/Recall/2014/14067/Camouflage%20Buckmark%20Hoodie%20SweatshirtTHUMB.png,63,87,e1b6c918effea99ea2ce03ca8c2ef335444ef46d,Browning Recalls Junior Hoodie Due to Strangulation and Entrapment Hazard; Sold Exclusively at Academy Sports+Outdoors,2013-12,http://www.cpsc.gov/en/Recalls/2014/Browning-Recalls-Junior-Hoodie/,"[u'exclusively', u'sold', u'strangulation', u'hazard', u'entrapment']",Browning Recalls Junior Hoodie Due to Strangulation and Entrapment Hazard; Sold Exclusively at Academy Sports+Outdoors
2013-12-19,2013-12-19T09:00:00+00:00,"Thu, 19 Dec 2013 09:00:00 GMT",1387443600,The steel toe cap in the men's boots could fail to protect the wearer's feet in an impact.,http://www.cpsc.gov/Global/Images/Recall/2014/14066/RedWingBoot133x97.jpg,63,87,1a8cbcf7c13eadfd52598201aead3eec4f484f0c,Red Wing Shoes Recalls Steel Toe Work Boots Due to Impact Hazard,2013-12,http://www.cpsc.gov/en/Recalls/2014/Red-Wing-Shoes-Recalls-Steel-Toe-Work-Boots/,"[u'impact', u'hazard']",Red Wing Shoes Recalls Steel Toe Work Boots Due to Impact Hazard
2013-12-18,2013-12-18T13:00:00+00:00,"Wed, 18 Dec 2013 13:00:00 GMT",1387371600,"The front fork can separate and cause the front wheel to detach. The forks were sold on some BMC, Cannondale, Commencal, Diamondback, GT, Kona, Lapierre, Norco, Orbea, Raleigh, Rocky Mountain, Santa Cruz, Scott, Specialized and Trek bicycles.",http://www.cpsc.gov/Global/Images/Recall/2014/14063/Fox%20-%20Suspension%20Fork%20THUMB.jpg,63,87,a08008eb973c93c85915e1bed3bb1220ebe07a8c,Fox Factory Recalls Evolution Mountain Bike Suspension Forks Due to Fall Hazard,2013-12,http://www.cpsc.gov/en/Recalls/2014/Fox-Factory-Recalls-Evolution-Mountain-Bike-Suspension-Forks/,"[u'hazard', u'fall']",Fox Factory Recalls Evolution Mountain Bike Suspension Forks Due to Fall Hazard
2013-12-18,2013-12-18T09:00:00+00:00,"Wed, 18 Dec 2013 09:00:00 GMT",1387357200,"The clear, colorless Bristol Valley glasses were sold individually and in cartons for commercial users. Glasses can break unexpectedly. ",http://www.cpsc.gov/Global/Images/Recall/2014/14065/LibbeyCocktailGlass133x97.jpg,63,87,2b2fb2bc32d6d318e4aea1d720467cf73809e1f2,Libbey Glass Recalls Cocktail Glasses Due to Laceration Hazard,2013-12,http://www.cpsc.gov/en/Recalls/2014/Libbey-Glass-Recalls-Cocktail-Glasses/,"[u'laceration', u'hazard']",Libbey Glass Recalls Cocktail Glasses Due to Laceration Hazard
2013-12-17,2013-12-17T09:00:00+00:00,"Tue, 17 Dec 2013 09:00:00 GMT",1387270800,Recalled chargers were sold with HP Chromebook 11 laptop computers. Google has received reports of chargers overheating and melting during use.,http://www.cpsc.gov/Global/Images/Recall/2014/14061/HPChromebookCharger133x97.jpg,63,87,66055f81ff78e77e46a79a0c019feca04ccfe5a9,Google and HP Recall HP Chromebook 11 Chargers Due to Fire and Burn Hazards; Charger Can Overheat and Melt,2013-12,http://www.cpsc.gov/en/Recalls/2014/Google-and-HP-Recall-HP-Chromebook-11-Chargers/,"[u'hazards', u'fire', u'burn']",Google and HP Recall HP Chromebook 11 Chargers Due to Fire and Burn Hazards; Charger Can Overheat and Melt
2013-12-16,2013-12-16T11:00:00+00:00,"Mon, 16 Dec 2013 11:00:00 GMT",1387191600,The girls' hooded jackets have drawstrings at the neck.,http://www.cpsc.gov/Global/Images/Recall/2014/14050/gray%20jacket133X97a.jpg,63,87,4d3ef4367140dfae1abc11a8658f7449e3168a64,Mirage Fashions Recalls Yoki Girls Faux Leather Jackets with Drawstrings Due to Strangulation Hazard; Sold Exclusively at Burlington Coat Factory,2013-12,http://www.cpsc.gov/en/Recalls/2014/Mirage-Fashions-Recalls-Yoki-Girls-Faux-Leather-Jackets-with-Drawstrings/,"[u'exclusively', u'sold', u'strangulation', u'hazard']",Mirage Fashions Recalls Yoki Girls Faux Leather Jackets with Drawstrings Due to Strangulation Hazard; Sold Exclusively at Burlington Coat Factory
2013-12-16,2013-12-16T10:00:00+00:00,"Mon, 16 Dec 2013 10:00:00 GMT",1387188000,"Vapors from the propellant in the Total Care product with model number 03772 can ignite upon contact with hair clippers, shavers or trimmers.",http://www.cpsc.gov/Global/Images/Recall/2014/14059/Total%20Care%20Thumbnail.jpg,63,87,68810c3374417d0ed3a8560ae7748fb904983bd6,Wahl Recalls Total Care Aerosol Cleaner Due to Burn Hazard,2013-12,http://www.cpsc.gov/en/Recalls/2014/Wahl-Recalls-Total-Care-Aerosol-Cleaner/,"[u'burn', u'hazard']",Wahl Recalls Total Care Aerosol Cleaner Due to Burn Hazard
2013-12-16,2013-12-16T09:00:00+00:00,"Mon, 16 Dec 2013 09:00:00 GMT",1387184400,The electrical components of the Twinkling Pine pre-lit artificial Christmas tree's light strings can overheat and melt. The tree was sold under the Enchanted Forrest brand.,http://www.cpsc.gov/Global/Images/Recall/2014/14058/SMALL_SSC%20Tree%20-%20Box%20Label.jpg,63,87,9b37bacccce4270828d73e49da5ebd11d5cbf1e0,"Seasonal Specialties Recalls Pre-lit Christmas Trees Due to Fire, Burn and Shock Hazards; Sold Exclusively at Menards",2013-12,http://www.cpsc.gov/en/Recalls/2014/Seasonal-Specialties-Recalls-Pre-lit-Christmas-Trees/,"[u'hazards', u'exclusively', u'fire', u'sold', u'burn', u'shock']","Seasonal Specialties Recalls Pre-lit Christmas Trees Due to Fire, Burn and Shock Hazards; Sold Exclusively at Menards"
2013-12-12,2013-12-12T14:00:00+00:00,"Thu, 12 Dec 2013 14:00:00 GMT",1386856800,The front legs on the black wooden accent chairs can detach.,http://www.cpsc.gov/Global/Images/Recall/2014/14057/Black%20Accent%20Chair%20SKU%205218300%20Thumbnail.jpg,63,87,1d1db35e1a3c4cf0c5e236d009192f80a35d54f4,Hobby Lobby Stores Recalls Accent Chairs Due to Risk of Injury,2013-12,http://www.cpsc.gov/en/Recalls/2014/Hobby-Lobby-Stores-Recalls-Accent-Chairs/,"[u'stores', u'injury', u'risk', u'chairs']",Hobby Lobby Stores Recalls Accent Chairs Due to Risk of Injury
2013-12-12,2013-12-12T13:00:00+00:00,"Thu, 12 Dec 2013 13:00:00 GMT",1386853200,"These soft and colorful, water-absorbing polymer toys can be mistaken by a child for candy. When swallowed, they can expand inside a child's body and block the intestine and can be life threatening.",http://www.cpsc.gov/Global/Images/Recall/2014/14056/JellyBeadzFruityFunShapes133X97.jpg,63,87,bf7b6ede1f19d47970c5dd76b7969dde2d058265,Doodlebutt Recalls Jelly BeadZ Jumbo BeadZ and Magic Growing Fruity Fun Toys Due to Serious Ingestion Hazard,2013-12,http://www.cpsc.gov/en/Recalls/2014/Doodlebutt-Recalls-Jelly-BeadZ-Jumbo-BeadZ-and-Magic-Growing-Fruity-Fun-Toys/,"[u'toys', u'serious', u'hazard', u'ingestion']",Doodlebutt Recalls Jelly BeadZ Jumbo BeadZ and Magic Growing Fruity Fun Toys Due to Serious Ingestion Hazard
2013-12-12,2013-12-12T12:00:00+00:00,"Thu, 12 Dec 2013 12:00:00 GMT",1386849600,"Trek has received reports of loose front brake attachment bolts in model year 2013 Madone bikes, including some custom-made Madones.",http://www.cpsc.gov/Global/Images/Recall/2014/14055/TrekMadone62133x97.jpg,63,87,d7e1d40703caa55c11408e0cc9093b2c5f4fd4c3,Trek Recalls Madone Bicycles Due to Crash Hazard; Front Brake Can Fail,2013-12,http://www.cpsc.gov/en/Recalls/2014/Trek-Recalls-Madone-Bicycles/,"[u'bicycles', u'crash', u'hazard']",Trek Recalls Madone Bicycles Due to Crash Hazard; Front Brake Can Fail
2013-12-12,2013-12-12T11:00:00+00:00,"Thu, 12 Dec 2013 11:00:00 GMT",1386846000,"An electronic component in the TVs can fail, catch fire and ignite nearby items.",http://www.cpsc.gov/Global/Images/Recall/2014/14054/CobyTelevision133x97.jpg,63,87,77cfb042972077ff79b08d90c521274a077dc348,Twelve Retailers Recall 32” Coby Flat Screen Televisions Due to Fire and Burn Hazards,2013-12,http://www.cpsc.gov/en/Recalls/2014/Twelve-Retailers-Recall-32-Coby-Flat-Screen-Televisions/,"[u'hazards', u'fire', u'burn']",Twelve Retailers Recall 32” Coby Flat Screen Televisions Due to Fire and Burn Hazards
2013-12-12,2013-12-12T10:00:00+00:00,"Thu, 12 Dec 2013 10:00:00 GMT",1386842400,The Aristocrat II brand carpet fails to meet federal flammability standards. ,http://www.cpsc.gov/Global/Images/Recall/2014/14053/Carpet133x97.jpg,63,87,53f37d3bb647272bc5e07e9fd3564417e8d8c624,Shaw Industries Recalls Carpet Due to Fire Hazard; Sold Exclusively at Lowe's Stores,2013-12,http://www.cpsc.gov/en/Recalls/2014/Shaw-Industries-Recalls-Carpet/,"[u'stores', u'exclusively', u'fire', u'sold', u'hazard']",Shaw Industries Recalls Carpet Due to Fire Hazard; Sold Exclusively at Lowe's Stores
2013-12-11,2013-12-11T14:30:00+00:00,"Wed, 11 Dec 2013 14:30:00 GMT",1386772200,Children can get tangled in the lamp's cord and strangle. Two children in Europe pulled the lamp cords into their cribs and became tangled in the cord. One strangled.,http://www.cpsc.gov/Global/Images/News%20Releases/2014/14052/SMILAStjarna133x97.jpg,63,87,6b9e8d3ecfefc9534800f760468ab10da8af321b,IKEA Recalls Children's Wall-Mounted Lamps Due to Strangulation Hazard; One Child Death Reported,2013-12,http://www.cpsc.gov/en/Recalls/2014/IKEA-Recalls-Childrens-Wall-Mounted-Lamps/,"[u'children', u'strangulation', u'hazard']",IKEA Recalls Children's Wall-Mounted Lamps Due to Strangulation Hazard; One Child Death Reported
2013-12-11,2013-12-11T13:30:00+00:00,"Wed, 11 Dec 2013 13:30:00 GMT",1386768600,The IQ Girls hooded jackets have a drawstring through the hood.These drawstrings are a hazard to children.,http://www.cpsc.gov/Global/Images/Recall/2014/14051/pink%20jacket133x97a.jpg,63,87,dc29dcd749c548c1f9db3f694d89fedb8da12d7d,Ram's Imports Recalls Girls' Pink Leopard Jackets Due to Strangulation Hazard; Sold Exclusively at Burlington Coat Factory,2013-12,http://www.cpsc.gov/en/Recalls/2014/Rams-Imports-Recalls-Girls-Pink-Leopard-Jackets/,"[u'exclusively', u'sold', u'strangulation', u'hazard']",Ram's Imports Recalls Girls' Pink Leopard Jackets Due to Strangulation Hazard; Sold Exclusively at Burlington Coat Factory
2013-12-11,2013-12-11T10:00:00+00:00,"Wed, 11 Dec 2013 10:00:00 GMT",1386756000,The plastic port hole windows in the tube slide can break and cut children.,http://www.cpsc.gov/Global/Images/Recall/2014/14049/SolowaveSlide133x97.jpg,63,87,0215ed1e38345288a6bbbbc6ea85439a793d6de6,Solowave Recalls Home Playground Tube Slides with Port Holes Due to Laceration Hazard,2013-12,http://www.cpsc.gov/en/Recalls/2014/Solowave-Recalls-Home-Playground-Tube-Slides-with-Port-Holes/,"[u'home', u'laceration', u'hazard']",Solowave Recalls Home Playground Tube Slides with Port Holes Due to Laceration Hazard
2013-12-10,2013-12-10T13:00:00+00:00,"Tue, 10 Dec 2013 13:00:00 GMT",1386680400,"The bed bug heaters sold with bed bug treatment systems can overheat, melt and cause a fire.",http://www.cpsc.gov/Global/Images/Recall/2014/14048/PackTitebagandheater133x97.jpg,63,87,9fb4384124cbe9936ea92a2b0c3cb2d381ce20f7,PackTite Recalls Bed Bug Heating Units Due to Fire Hazard,2013-12,http://www.cpsc.gov/en/Recalls/2014/PackTite-Recalls-Bed-Bug-Heating-Units/,"[u'fire', u'hazard']",PackTite Recalls Bed Bug Heating Units Due to Fire Hazard
2013-12-10,2013-12-10T11:30:00+00:00,"Tue, 10 Dec 2013 11:30:00 GMT",1386675000,The muffler on the landscape trimmer's engine can break. The trimmers are used for cutting grass and light brush.,http://www.cpsc.gov/Global/Images/Recall/2014/14047/efco%20model%208371%20T%20THUMB.jpg,63,87,8f90173729cfd094fa4c80dc9259048e173dbd73,Gas Trimmers Recalled by efco Due to Fire Hazard,2013-12,http://www.cpsc.gov/en/Recalls/2014/Gas-Trimmers-Recalled-by-efco/,"[u'fire', u'hazard']",Gas Trimmers Recalled by efco Due to Fire Hazard
2013-12-10,2013-12-10T10:00:00+00:00,"Tue, 10 Dec 2013 10:00:00 GMT",1386669600,The blade on the 30-inch mowers can break and injure the user and others nearby. ,http://www.cpsc.gov/Global/Images/Recall/2014/14046/SMALL_Toro%20TimeMaster.jpg,63,87,a84e446ba0effb3dd20d0593f4e6147fbac6f618,Toro Recalls TimeMaster and TurfMaster Lawn Mowers Due To Injury Hazard,2013-12,http://www.cpsc.gov/en/Recalls/2014/Toro-Recalls-TimeMaster-and-TurfMaster-Lawn-Mowers/,"[u'injury', u'hazard']",Toro Recalls TimeMaster and TurfMaster Lawn Mowers Due To Injury Hazard
2013-12-10,2013-12-10T09:00:00+00:00,"Tue, 10 Dec 2013 09:00:00 GMT",1386666000,The 30-inch mower's blade can break and injure the user and others nearby.,http://www.cpsc.gov/Global/Images/Recall/2014/14045/SMALL_2013_Commercial_30_left_front.jpg,63,87,c244518738d8135409063dd47f252925eb0ea567,Exmark Recalls Commercial Walk-Behind Mowers Due to Injury Hazard,2013-12,http://www.cpsc.gov/en/Recalls/2014/Exmark-Recalls-Commercial-Walk-Behind-Mowers/,"[u'injury', u'hazard']",Exmark Recalls Commercial Walk-Behind Mowers Due to Injury Hazard
2013-12-09,2013-12-09T13:00:00+00:00,"Mon, 09 Dec 2013 13:00:00 GMT",1386594000,"The battery clips in the emergency call pendant transmitters can corrode causing the transmitters to operate intermittently or not at all, without generating a warning.",http://www.cpsc.gov/Global/Images/Recall/2014/14044/DXSLRC%20pendant%20and%20wristband%20THUMB.jpg,63,87,ffd579be000818370340668b1523ea3571edc7c1,Linear Recalls Personal Emergency Reporting System Transmitters Due to Battery Signal Failure,2013-12,http://www.cpsc.gov/en/Recalls/2014/Linear-Recalls-Personal-Emergency-Reporting-System-Transmitters/,[],Linear Recalls Personal Emergency Reporting System Transmitters Due to Battery Signal Failure
2013-12-05,2013-12-05T13:00:00+00:00,"Thu, 05 Dec 2013 13:00:00 GMT",1386248400,Hooded windsuits have drawstrings around the neck area. Children can become tangled in neck and waist drawstrings in upper outwear.,http://www.cpsc.gov/Global/Images/Recall/2014/14043/PINK133X97.jpg,63,87,c8572d3ba728fdfee5c5510a0deb2a9746c0cded,Academy Sports + Outdoors Recalls Girls BCG Hooded Windsuits Due to Strangulation Hazard,2013-12,http://www.cpsc.gov/en/Recalls/2014/Academy-Sports-Outdoors-Recalls-Girls-BCG-Hooded-Windsuits/,"[u'strangulation', u'hazard']",Academy Sports + Outdoors Recalls Girls BCG Hooded Windsuits Due to Strangulation Hazard
2013-12-04,2013-12-04T14:00:00+00:00,"Wed, 04 Dec 2013 14:00:00 GMT",1386165600,The mower blades can detach during use or start without being activated by the operator. Also the vehicle can move forward unexpectedly and the fuel lines can leak.,http://www.cpsc.gov/Global/Images/Recall/2014/14704/Thumbnail-14704%20MPV%20SMALL.jpg,63,87,3b3f5a9f4c9f3e34351b6f45fc29a2f32e7e2796,"Denver Global Products Recalls Multi-Purpose Yard Vehicles Due to Laceration, Fire Hazards; Sold Exclusively at Lowe's Stores (Recall Alert)",2013-12,http://www.cpsc.gov/en/Recalls/Recall-Alerts/2014/Denver-Global-Products-Recalls-Multi-Purpose-Yard-Vehicles/,"[u'vehicles', u'stores', u'laceration', u'hazards', u'exclusively', u'fire', u'sold', u'alert', u'products']","Denver Global Products Recalls Multi-Purpose Yard Vehicles Due to Laceration, Fire Hazards; Sold Exclusively at Lowe's Stores (Recall Alert)"
2013-12-04,2013-12-04T13:00:00+00:00,"Wed, 04 Dec 2013 13:00:00 GMT",1386162000,The girls' long sleeve hooded jackets and pant sets have drawstrings through the hood. ,http://www.cpsc.gov/Global/Images/Recall/2014/14040/Hooded%20SetTHUMB.jpg,63,87,fba00f33ead249b88f647e8a345c842630439986,Wearever Girl's Hooded Jacket Sets Recalled by David's Place Due to Strangulation Hazard; Sold Exclusively at Burlington Coat Factory,2013-12,http://www.cpsc.gov/en/Recalls/2014/Wearever-Girls-Hooded-Jacket-Sets-Recalled-by-Davids-Place/,"[u'exclusively', u'sold', u'strangulation', u'hazard', u'sets']",Wearever Girl's Hooded Jacket Sets Recalled by David's Place Due to Strangulation Hazard; Sold Exclusively at Burlington Coat Factory
2013-12-04,2013-12-04T12:00:00+00:00,"Wed, 04 Dec 2013 12:00:00 GMT",1386158400,"The colored arches on the infant toy can break, creating a small part. ",http://www.cpsc.gov/Global/Images/Recall/2014/14039/ManhattanQuixelbaby%20rattles133x97.jpg,63,87,9c83e8a18638bb4add0df2e57f261d9ce6663277,Manhattan Group Recalls Baby Rattles Due to Choking Hazard,2013-12,http://www.cpsc.gov/en/Recalls/2014/Manhattan-Group-Recalls-Baby-Rattles/,"[u'choking', u'hazard', u'baby']",Manhattan Group Recalls Baby Rattles Due to Choking Hazard
2013-12-04,2013-12-04T11:00:00+00:00,"Wed, 04 Dec 2013 11:00:00 GMT",1386154800,The SRAM RED WiFLi Rear Derailleur that moves the bike chain gears on the rear wheel can jam.,http://www.cpsc.gov/Global/Images/Recall/2014/14038/SRAM%20Rear%20Derailleur%20THUMB.jpg,63,87,bf343fcbcd1f4021cdf256b953067226ffa9927a,SRAM Recalls Derailleurs for Bicycles Due to Fall Hazard,2013-12,http://www.cpsc.gov/en/Recalls/2014/SRAM-Recalls-Derailleurs-for-Bicycles/,"[u'bicycles', u'hazard', u'fall']",SRAM Recalls Derailleurs for Bicycles Due to Fall Hazard
2013-12-04,2013-12-04T10:00:00+00:00,"Wed, 04 Dec 2013 10:00:00 GMT",1386151200,The front assembly on the K2 Revo Kick can break and the handle can detach and cause a rider to lose control or balance.,http://www.cpsc.gov/Global/Images/Recall/2014/14037/K2SportsKickboard133x97.jpg,63,87,dba6fb07d5cc10eb2d4ca7fe26f1d99742a096b1,K2 Sports Recalls Kickboards/Scooters Due to Fall Hazard,2013-12,http://www.cpsc.gov/en/Recalls/2014/K2-Sports-Recalls-Kickboard-Scooters/,"[u'hazard', u'fall']",K2 Sports Recalls Kickboards/Scooters Due to Fall Hazard
2013-12-03,2013-12-03T12:00:00+00:00,"Tue, 03 Dec 2013 12:00:00 GMT",1386072000,"The twin, full, queen and king-sized mattresses were rebuilt. They pose a fire hazard to consumers.",http://www.cpsc.gov/Global/Images/Recall/2014/14036/LFMattressTHUMB.jpg,63,87,274c99d0a1fe2c2194d851997b31cccc50c707ff,L&F International Trade Recalls Renovated Mattresses Due to Violation of Federal Mattress Flammability Standard,2013-12,http://www.cpsc.gov/en/Recalls/2014/LF-International-Trade-Recalls-Renovated-Mattresses/,"[u'violation', u'federal', u'flammability', u'standard']",L&F International Trade Recalls Renovated Mattresses Due to Violation of Federal Mattress Flammability Standard
2013-12-03,2013-12-03T10:45:00+00:00,"Tue, 03 Dec 2013 10:45:00 GMT",1386067500,The air pressure switch on CWD series cast-iron natural gas or liquid petroleum hot water boilers can fail to shut down the burners when required.,http://www.cpsc.gov/Global/Images/Recall/2014/14035/Thumbnail-14035%20Cabo-2%20Boiler%20SMALL.jpg,63,87,1d5be796813f8b2a35f326abded962349d4feefd,Crown Boiler Recalls Home Heating Boilers Due to Carbon Monoxide Hazard,2013-12,http://www.cpsc.gov/en/Recalls/2014/Crown-Boiler-Recalls-Home-Heating-Boilers/,"[u'home', u'hazard']",Crown Boiler Recalls Home Heating Boilers Due to Carbon Monoxide Hazard
2013-11-26,2013-11-26T12:00:00+00:00,"Tue, 26 Nov 2013 12:00:00 GMT",1385467200,"The top strap on ""Falls Creek Baby""-style sandals can be pulled loose from the shoe.",http://www.cpsc.gov/Global/Images/Recall/2014/14031/MeijerSandalStyleGNBN9235MJTHUMB.jpg,63,87,af99dcb652096bf7f9591d5fe9285b72273d6cfb,American Boy and Girl Recalls Infant Sandals Due to Choking Hazard; Sold Exclusively at Meijer Stores,2013-11,http://www.cpsc.gov/en/Recalls/2014/American-Boy-and-Girl-Recalls-Infant-Sandals/,"[u'infant', u'stores', u'choking', u'exclusively', u'sold', u'hazard']",American Boy and Girl Recalls Infant Sandals Due to Choking Hazard; Sold Exclusively at Meijer Stores
2013-11-26,2013-11-26T11:00:00+00:00,"Tue, 26 Nov 2013 11:00:00 GMT",1385463600,The Little Willy's brand hoodies have drawstrings through the hood. ,http://www.cpsc.gov/Global/Images/Recall/2014/14032/LittleWillysHoodieTHUMB.jpg,63,87,35ab5987766c790662d9db8e975f573af4dbc4c0,Little Willy's Recalls Hooded Sweatshirts Due to Strangulation Hazard,2013-11,http://www.cpsc.gov/en/Recalls/2014/Little-Willys-Recalls-Hooded-Sweatshirts/,"[u'strangulation', u'hazard']",Little Willy's Recalls Hooded Sweatshirts Due to Strangulation Hazard
2013-11-26,2013-11-26T10:00:00+00:00,"Tue, 26 Nov 2013 10:00:00 GMT",1385460000,The racks used for hitching children's trailercycles to adult size bicycles can break.,http://www.cpsc.gov/Global/Images/Recall/2014/14033/TailwindRackDetail133x97.jpg,63,87,1be85ae3a5461356237a464b40417491327602aa,Burley Design Recalls Tailwind Racks for Trailercycles Due to Fall Hazard,2013-11,http://www.cpsc.gov/en/Recalls/2014/Burley-Design-Recalls-Tailwind-Racks-for-Trailercycles/,"[u'hazard', u'fall']",Burley Design Recalls Tailwind Racks for Trailercycles Due to Fall Hazard
2013-11-26,2013-11-26T09:00:00+00:00,"Tue, 26 Nov 2013 09:00:00 GMT",1385456400,"The trigger assembly on airbags used for skiing, snowmobiles and mountain climbing can fail, resulting in the airbag not deploying.",http://www.cpsc.gov/Global/Images/Recall/2014/14030/SMALL_Pack%20With%20Lot%20Letter%20Location.jpg,63,87,a64d0e30677c6bb2cf1d4b9e3fd6a212759d3a27,Avalanche Airbags Recalled by Backcountry Access Due to Risk of Injury,2013-11,http://www.cpsc.gov/en/Recalls/2014/Avalanche-Airbags-Recalled-by-Backcountry-Access/,"[u'injury', u'risk']",Avalanche Airbags Recalled by Backcountry Access Due to Risk of Injury
2013-11-21,2013-11-21T14:00:00+00:00,"Thu, 21 Nov 2013 14:00:00 GMT",1385042400,The reversible slicing/shredding disc can loosen and the blade can strike and break the food processor's cover. The cover's broken plastic pieces can hit consumers.,http://www.cpsc.gov/Global/Images/Recall/2014/14029/Cuisinart133x97.jpg,63,87,78cff5af6f5c96291349689110c29156c12738cd,Cuisinart Recalls Food Processors Due to Laceration Hazard,2013-11,http://www.cpsc.gov/en/Recalls/2014/Cuisinart-Recalls-Food-Processors/,"[u'laceration', u'hazard']",Cuisinart Recalls Food Processors Due to Laceration Hazard
2013-11-21,2013-11-21T13:00:00+00:00,"Thu, 21 Nov 2013 13:00:00 GMT",1385038800,The outdoor elliptical cycles used for exercise have drive arm axle and fork detachment problems.,http://www.cpsc.gov/Global/Images/Recall/2014/14027/EliptoGO3CModelTHUMB.jpg,63,87,e181daa3e1decc1e306bc75ac32a13aaef92ac74,ElliptiGO Recalls Elliptical Cycles Due to Fall Hazard,2013-11,http://www.cpsc.gov/en/Recalls/2014/ElliptiGO-Recalls-Elliptical-Cycles/,"[u'hazard', u'fall']",ElliptiGO Recalls Elliptical Cycles Due to Fall Hazard
2013-11-21,2013-11-21T10:00:00+00:00,"Thu, 21 Nov 2013 10:00:00 GMT",1385028000,"The cord attached to the baby monitor's sensor pad is placed under the crib mattress. If the child pulls the cord into the crib, it can become wrapped around the baby's neck.",http://www.cpsc.gov/Global/Images/Recall/2014/14028/AngelCareMonitorTHUMB.jpg,63,87,3533fe65c563ea39da72d648fac16f53665c0b38,Angelcare Recalls to Repair Movement and Sound Baby Monitors After Two Deaths Due to Strangulation Hazard,2013-11,http://www.cpsc.gov/en/Recalls/2014/Angelcare-Recalls-to-Repair-Movement-and-Sound-Baby-Monitors-After-Two-Deaths/,"[u'strangulation', u'hazard', u'baby']",Angelcare Recalls to Repair Movement and Sound Baby Monitors After Two Deaths Due to Strangulation Hazard
2013-11-21,2013-11-21T09:00:00+00:00,"Thu, 21 Nov 2013 09:00:00 GMT",1385024400,The J.Bailey pajama pants for boys fail to meet children's sleepwear requirements.,http://www.cpsc.gov/Global/Images/Recall/2014/14026/1001CHADTURTLE133x97.jpg,63,87,b7b20deaf07f856a9deeb7f25949a415b4eee6af,Children's Pajamas Recalled by The Bailey Boys Due to Violation of Federal Flammability Standard,2013-11,http://www.cpsc.gov/en/Recalls/2014/Childrens-Pajamas-Recalled-by-The-Bailey-Boys/,"[u'violation', u'children', u'federal', u'flammability', u'standard']",Children's Pajamas Recalled by The Bailey Boys Due to Violation of Federal Flammability Standard
2013-11-19,2013-11-19T14:30:00+00:00,"Tue, 19 Nov 2013 14:30:00 GMT",1384871400,"The front fork can separate from the wheel on Baja MB200 gas-powered mini bikes. This minibike may also be known as WR96, WR200, Baja Heat, Baja Carbon and Mini Baja.",http://www.cpsc.gov/Global/Images/Recall/2014/14024/Thumb14024BajaMiniBikeSMALL.jpg,63,87,be5fd1bb4ca26e830f299b362d8281bd3197305c,"Baja Motorsports Recalls Mini Bikes Due to Fall, Crash Hazard",2013-11,http://www.cpsc.gov/en/Recalls/2014/Baja-Motorsports-Recalls-Mini-Bikes/,"[u'crash', u'hazard', u'fall']","Baja Motorsports Recalls Mini Bikes Due to Fall, Crash Hazard"
