date:iso,datetime:iso,datetime:rss,datetime:unix,description,feature_image,feature_image:height,feature_image:width,id,label,month:iso,source,tags,title
2013-02-06,2013-02-06T16:30:00+00:00,"Wed, 06 Feb 2013 16:30:00 GMT",1360168200,"The jar lifter handle can detach. This can cause the tongs to fail to grip and allow a jar being lifted to fall, posing a laceration hazard to the user.",http://www.cpsc.gov/PageFiles/140948/13116_thumb.jpg,63,87,f12ddacde8fc2c1925f4ff55d29cce6e98e1d00c,Progressive International Recalls Canning Jar Lifters Due to Laceration Hazard,2013-02,http://www.cpsc.gov/en/Recalls/2013/Progressive-International-Recalls-Canning-Jar-Lifters/,"[u'laceration', u'hazard']",Progressive International Recalls Canning Jar Lifters Due to Laceration Hazard
2013-02-06,2013-02-06T09:30:00+00:00,"Wed, 06 Feb 2013 09:30:00 GMT",1360143000,The sheets are too small for the play yards. A sheet that does not properly fit the play yard poses an entrapment hazard that could lead to suffocation.,http://www.cpsc.gov/PageFiles/140753/4moms_thumb.jpg,63,87,dee493c25412d8991cbf6119bb33b4743c56d9b4,Play Yard Sheets Recalled by 4moms Due to Entrapment Hazard,2013-02,http://www.cpsc.gov/en/Recalls/2013/Play-Yard-Sheets-Recalled-by-4moms/,"[u'hazard', u'entrapment']",Play Yard Sheets Recalled by 4moms Due to Entrapment Hazard
2013-02-05,2013-02-05T13:00:00+00:00,"Tue, 05 Feb 2013 13:00:00 GMT",1360069200,Fornasetti Profumi Grande scented candles can burn with a high flame.,http://www.cpsc.gov/PageFiles/140683/13722thumb.jpg,63,87,31163fc44c2272704bfbb46d54d00cda6368ffc8,Large Scented Candles Recalled by Barneys New York Due to Fire and Burn Hazard,2013-02,http://www.cpsc.gov/en/Recalls/2013/Large-Scented-Candles/,"[u'fire', u'burn', u'hazard']",Large Scented Candles Recalled by Barneys New York Due to Fire and Burn Hazard
2013-02-05,2013-02-05T09:30:00+00:00,"Tue, 05 Feb 2013 09:30:00 GMT",1360056600,The fuel hose in model year 2013 gas-powered golf and transport vehicles used for short-distance transportation could separate from the fuel tank.,http://www.cpsc.gov/PageFiles/140652/13721thumb.jpg,63,87,c9ca5955bfb9b16a0d34ba8c2b563cf0565217a2,Club Car Recalls Golf and Transport Vehicles Due to Fire Hazard,2013-02,http://www.cpsc.gov/en/Recalls/2013/Club-Car-Recalls-Golf-and-Transport-Vehicles/,"[u'vehicles', u'fire', u'hazard']",Club Car Recalls Golf and Transport Vehicles Due to Fire Hazard
2013-01-31,2013-01-31T15:30:00+00:00,"Thu, 31 Jan 2013 15:30:00 GMT",1359646200,"The child-resistant caps on these medicines do not work properly. Recalled medicines were manufactured before December 21, 2011.",http://www.cpsc.gov/PageFiles/140375/13114thumb.jpg,63,87,3209c760e3b1a72984d0fa3650c0c0f352ed6e7b,Triaminic and Theraflu Products Recalled Due to Failure to Meet Child-Resistant Closure Requirement; Risk of Poisoning,2013-01,http://www.cpsc.gov/en/Recalls/2013/Triaminic-and-Theraflu-Products-Recalled/,"[u'risk', u'products']",Triaminic and Theraflu Products Recalled Due to Failure to Meet Child-Resistant Closure Requirement; Risk of Poisoning
2013-01-31,2013-01-31T14:00:00+00:00,"Thu, 31 Jan 2013 14:00:00 GMT",1359640800,The supplement tablets inside the bottle contain iron and can cause serious injury or death to young children if multiple tablets are ingested at once.,http://www.cpsc.gov/PageFiles/140440/13113thumb.jpg,63,87,f828a4be10afc6f81ce4500b2066a5e5b78be8ca,FoodState Recalls Bottles of MegaFood One Daily Supplements Due to Lack of Child-Resistant Packaging,2013-01,http://www.cpsc.gov/en/Recalls/2013/FoodState-Recalls-Bottles-of-MegaFood-One-Daily-Supplements/,[],FoodState Recalls Bottles of MegaFood One Daily Supplements Due to Lack of Child-Resistant Packaging
2013-01-31,2013-01-31T13:30:00+00:00,"Thu, 31 Jan 2013 13:30:00 GMT",1359639000,Openings between the metal rails are larger than what is allowed in the standard. A child could get trapped in the opening. ,http://www.cpsc.gov/PageFiles/140429/13113thumb.jpg,63,87,f0b7c31759710f06aac63476c565429f57314e84,World Imports Recalls Bunk Beds Due to Violation of Safety Standard,2013-01,http://www.cpsc.gov/en/Recalls/2013/World-Imports-Recalls-Bunk-Beds/,"[u'violation', u'standard']",World Imports Recalls Bunk Beds Due to Violation of Safety Standard
2013-01-31,2013-01-31T11:00:00+00:00,"Thu, 31 Jan 2013 11:00:00 GMT",1359630000,If two or more magnets are swallowed they can link together inside a child's intestines.,http://www.cpsc.gov/PageFiles/140401/13111thumb.jpg,63,87,c3476633cccd45906550349b9ccdfe46f0dbaa09,Kringles Toys and Gifts Recalls High Powered Magnets Due to Ingestion Hazard; Sold Exclusively on Amazon.com,2013-01,http://www.cpsc.gov/en/Recalls/2013/Kringles-Toys-and-Gifts-Recalls-High-Powered-Magnets/,"[u'toys', u'exclusively', u'sold', u'hazard', u'ingestion']",Kringles Toys and Gifts Recalls High Powered Magnets Due to Ingestion Hazard; Sold Exclusively on Amazon.com
2013-01-31,2013-01-31T12:00:00+00:00,"Thu, 31 Jan 2013 12:00:00 GMT",1359633600,If two or more magnets are swallowed they can link together inside a child's intestines. Internal injury from magnets can pose serious lifelong health effects.,http://www.cpsc.gov/PageFiles/140404/13112_thumb.jpg,63,87,2536bb6d68b3f22acc020e406617d6fa33f979d3,High Powered Magnet Balls Recalled by SCS Direct Due to Risk of Ingestion; Sold Exclusively on Amazon.com,2013-01,http://www.cpsc.gov/en/Recalls/2013/High-Powered-Magnet-Balls/,"[u'exclusively', u'risk', u'sold', u'ingestion']",High Powered Magnet Balls Recalled by SCS Direct Due to Risk of Ingestion; Sold Exclusively on Amazon.com
2013-01-30,2013-01-30T14:00:00+00:00,"Wed, 30 Jan 2013 14:00:00 GMT",1359554400,The enclosure netting surrounding these trampolines can break. Sportspower has received nine more reports of injuries since a May 2012 recall of this product.,http://www.cpsc.gov/PageFiles/140325/13107thumb.jpg,63,87,cff598a6630768c3fa3f1cdf2540ee49e6cb0ae3,Sportspower Expands Trampoline Recall Due to Fall Hazard; Sold Exclusively at Walmart,2013-01,http://www.cpsc.gov/en/Recalls/2013/Sportspower-Expands-Trampoline/,"[u'exclusively', u'sold', u'hazard', u'fall']",Sportspower Expands Trampoline Recall Due to Fall Hazard; Sold Exclusively at Walmart
2013-01-30,2013-01-30T12:00:00+00:00,"Wed, 30 Jan 2013 12:00:00 GMT",1359547200,"The dressers can become unstable and tip over when a child climbs on or in the dresser drawers. Two toddlers were reported to have suffocated when the dressers fell onto them, though the cause of the deaths has not been determined.",http://www.cpsc.gov/PageFiles/140302/Cherry%20Finish_thumb.jpg,63,87,3ca2919a26800e02e2c809a20fbce55e8fade159,Million Dollar Baby Dressers Recalled by Bexco Due to Tip-Over Hazards; Two Toddler Deaths Reported,2013-01,http://www.cpsc.gov/en/Recalls/2013/Million-Dollar-Baby-Dressers/,"[u'hazards', u'baby']",Million Dollar Baby Dressers Recalled by Bexco Due to Tip-Over Hazards; Two Toddler Deaths Reported
2013-01-30,2013-01-30T12:00:00+00:00,"Wed, 30 Jan 2013 12:00:00 GMT",1359547200,The dresser can tip over when a child climbs on or in the dresser drawers. CPSC and the company are aware of one report of a 2-year-old who suffocated when he climbed up and in a second drawer and the dresser fell on him.,http://www.cpsc.gov/PageFiles/140067/13105_thumb.jpg,63,87,b90394d44a2c7d2f3371a7e0f96350ed9d1d2f96,Natart Chelsea Dressers Recalled By Gemme Juvenile To Reduce Tip-Over Hazard; Death of Toddler Reported,2013-01,http://www.cpsc.gov/en/Recalls/2013/Natart-Chelsea-Dressers/,[u'hazard'],Natart Chelsea Dressers Recalled By Gemme Juvenile To Reduce Tip-Over Hazard; Death of Toddler Reported
2013-01-29,2013-01-29T12:00:00+00:00,"Tue, 29 Jan 2013 12:00:00 GMT",1359460800,The wrist cuff on seven models of men's and women's 2012 Columbia Omni-Heat jackets can overheat.,http://www.cpsc.gov/PageFiles/140001/13104_thumb.jpg,63,87,6a60bb2e4f89d4a873dd819751db9a14d3127b55,Columbia Sportswear Recalls Seven Models of Heated Jackets Due To Burn Hazard,2013-01,http://www.cpsc.gov/en/Recalls/2013/Columbia-Sportswear-Recalls-Seven-Models-of-Heated-Jackets/,"[u'burn', u'hazard']",Columbia Sportswear Recalls Seven Models of Heated Jackets Due To Burn Hazard
2013-01-29,2013-01-29T12:00:00+00:00,"Tue, 29 Jan 2013 12:00:00 GMT",1359460800,Debris from wet terrain areas can quickly collect and dry out in the exhaust pipe of 2011 - 2013 model vehicles.,http://www.cpsc.gov/PageFiles/139965/13103_thumb.jpg,63,87,404daa0ea9540197caacd75015d2fdd51b42c936,BRP Recalls Can-Am Side-By-Side Vehicles Due to Fire Hazard,2013-01,http://www.cpsc.gov/en/Recalls/2013/BRP-Recalls-Can-Am-Side-By-Side-Vehicles/,"[u'vehicles', u'fire', u'hazard']",BRP Recalls Can-Am Side-By-Side Vehicles Due to Fire Hazard
2013-01-25,2013-01-25T12:00:00+00:00,"Fri, 25 Jan 2013 12:00:00 GMT",1359115200,The steerer tube on the 2012 and 2013 model road bikes and framesets can break. ,http://www.cpsc.gov/PageFiles/139580/13102_thumb.jpg,63,87,312f5f113e67681e5b6caf8ed071c0f5a6d3f857,Specialized Bicycle Components Recalls Bicycles Due to Fall Hazard,2013-01,http://www.cpsc.gov/en/Recalls/2013/Specialized-Bicycle-Components-Recalls-Bicycles-Due-to-Fall-Hazard/,"[u'bicycles', u'hazard', u'fall']",Specialized Bicycle Components Recalls Bicycles Due to Fall Hazard
2013-01-23,2013-01-23T12:00:00+00:00,"Wed, 23 Jan 2013 12:00:00 GMT",1358942400,"The mattresses, which were sold in N.J, N.Y. and Pa., pose a fire hazard to consumers.",http://www.cpsc.gov/PageFiles/139109/13101_thumb.jpg,63,87,d7eb100efe1b195adf82a9b6b2117301ccb26b39,Mattress Cloud Recalls Mattresses Due to Violation of Federal Flammability Standard,2013-01,http://www.cpsc.gov/en/Recalls/2013/Mattress-Cloud-Recalls-Mattresses-Due-to-Violation-of-Federal-Flammability-Standard/,"[u'violation', u'federal', u'flammability', u'standard']",Mattress Cloud Recalls Mattresses Due to Violation of Federal Flammability Standard
2013-01-22,2013-01-22T12:30:00+00:00,"Tue, 22 Jan 2013 12:30:00 GMT",1358857800,Wall-mounted Q-Series sensors can overheat.,http://www.cpsc.gov/PageFiles/138901/13720_thumb.jpg,63,87,478786a67fe77e067cae38b92e81d8ec7cc9a68c,"Siemens Recalls Temperature and Humidity Sensors for Schools, Hospitals and Other Buildings Due to Fire Hazard",2013-01,http://www.cpsc.gov/en/Recalls/2013/Siemens-Recalls-Temperature-and-Humidity-Sensors-for-Schools-Hospitals-and-Other-Buildings-Due-to-Fire-Hazard/,"[u'fire', u'hazard']","Siemens Recalls Temperature and Humidity Sensors for Schools, Hospitals and Other Buildings Due to Fire Hazard"
2013-01-22,2013-01-22T12:00:00+00:00,"Tue, 22 Jan 2013 12:00:00 GMT",1358856000,The exercise bands can detach from the mesh cloth loops.,http://www.cpsc.gov/PageFiles/138888/13100_thumb.jpg,63,87,e49b9cd7a77a5c86d02bc495d57910b7653780e9,Implus Footcare Recalls Perfect Fitness Resistance Bands Due To Injury Hazard; Sold Exclusively at WalMart,2013-01,http://www.cpsc.gov/en/Recalls/2013/Implus-Footcare-Recalls-Perfect-Fitness-Resistance-Bands-Due-To-Injury-Hazard-Sold-Exclusively-at-WalMart/,"[u'exclusively', u'injury', u'sold', u'hazard']",Implus Footcare Recalls Perfect Fitness Resistance Bands Due To Injury Hazard; Sold Exclusively at WalMart
2013-01-17,2013-01-17T12:00:00+00:00,"Thu, 17 Jan 2013 12:00:00 GMT",1358424000,The reclining arm chair can tip over backwards when used in its fully reclined position.,http://www.cpsc.gov/PageFiles/138648/13719_thumb.jpg,63,87,58f48f0d736e4817c8b0770b8fbbc18bd8c8deaf,American Signature Recalls Hayward Push Back Chairs Due to Fall Hazard; Sold Exclusively at Value City Furniture and American Signature Furniture Stores,2013-01,http://www.cpsc.gov/en/Recalls/2013/American-Signature-Recalls-Hayward-Push-Back-Chairs-Due-to-Fall-Hazard/,"[u'stores', u'exclusively', u'sold', u'hazard', u'fall', u'chairs']",American Signature Recalls Hayward Push Back Chairs Due to Fall Hazard; Sold Exclusively at Value City Furniture and American Signature Furniture Stores
2013-01-17,2013-01-17T12:00:00+00:00,"Thu, 17 Jan 2013 12:00:00 GMT",1358424000,The on/off foot switch on Burien-model lamps with four light sockets can melt.,http://www.cpsc.gov/PageFiles/138589/13099_thumb.jpg,63,87,4df3cf4dd4f636a63afc3440346af76eebfc2c8c,Floor Lamps Recalled by Dolan Northwest Due to Shock and Fire Hazards,2013-01,http://www.cpsc.gov/en/Recalls/2013/Floor-Lamps-Recalled-by-Dolan-Northwest-Due-to-Shock-and-Fire-Hazards/,"[u'hazards', u'fire', u'shock']",Floor Lamps Recalled by Dolan Northwest Due to Shock and Fire Hazards
2013-01-17,2013-01-17T12:00:00+00:00,"Thu, 17 Jan 2013 12:00:00 GMT",1358424000,"The company has received more than 1,100 consumer reports of the stainless-steel cookware collapsing, crimping or deforming when exposed to heat. ",http://www.cpsc.gov/PageFiles/138569/13098_thumb.jpg,63,87,67cdd143ac21a35eb42bbc6b54dd66a9ea67afc1,Hy Cite Enterprises Recalls Royal Prestige Thermal Wall Pots and Pans Due to Burn and Fire Hazard,2013-01,http://www.cpsc.gov/en/Recalls/2013/Hy-Cite-Enterprises-Recalls-Royal-Prestige-Thermal-Wall-Pots-and-Pans-Due-to-Burn-and-Fire-Hazard/,"[u'fire', u'burn', u'hazard']",Hy Cite Enterprises Recalls Royal Prestige Thermal Wall Pots and Pans Due to Burn and Fire Hazard
2013-01-16,2013-01-16T12:00:00+00:00,"Wed, 16 Jan 2013 12:00:00 GMT",1358337600,The personal cooling devices can shatter during use.,http://www.cpsc.gov/PageFiles/138476/13097_thumb.jpg,63,87,0a5effb5b288130cde9a3d49ba4c0da3f22ff108,Target Recalls Hand-Held Air Misters Due to Injury Hazard,2013-01,http://www.cpsc.gov/en/Recalls/2013/Target-Recalls-Hand-Held-Air-Misters-Due-to-Injury-Hazard/,"[u'injury', u'hazard', u'air']",Target Recalls Hand-Held Air Misters Due to Injury Hazard
2013-01-16,2013-01-16T12:00:00+00:00,"Wed, 16 Jan 2013 12:00:00 GMT",1358337600,The backrest's adjustment brackets can break. The recalled workbenches are free-standing and are typically used for free weight workouts.,http://www.cpsc.gov/PageFiles/138458/13096_thumb.jpg,63,87,d4fd65d61698a8a90a4bcd65cc4e31044bc5379d,Powertec Recalls Weight Workbenches Due to Injury Hazard  ,2013-01,http://www.cpsc.gov/en/Recalls/2013/Powertec-Recalls-Weight-Workbenches-Due-to-Injury-Hazard/,"[u'injury', u'hazard']",Powertec Recalls Weight Workbenches Due to Injury Hazard  
2013-01-15,2013-01-15T12:00:00+00:00,"Tue, 15 Jan 2013 12:00:00 GMT",1358251200,The blanket sleepers fail to meet the federal flammability standard for children's sleepwear. This is a burn hazard to kids.,http://www.cpsc.gov/PageFiles/138410/13095_thumb.jpg,63,87,07ef13bf6fd6647898bd12858026a8f0dbb6a0a9,Target Recalls Circo Girls Fleece Pajamas Due to Violation of Federal Flammability Standard,2013-01,http://www.cpsc.gov/en/Recalls/2013/Target-Recalls-Circo-Girls-Fleece-Pajamas-Due-to-Violation-of-Federal-Flammability-Standard/,"[u'violation', u'federal', u'flammability', u'standard']",Target Recalls Circo Girls Fleece Pajamas Due to Violation of Federal Flammability Standard
2013-01-15,2013-01-15T12:00:00+00:00,"Tue, 15 Jan 2013 12:00:00 GMT",1358251200,The pajamas fail to meet the federal flammability standard for children's sleepwear. They pose a burn hazard to children.,http://www.cpsc.gov/PageFiles/138401/13093_thumb.jpg,63,87,d3336aa3fff3cb0b4cd997d9fccf88f851c144a5,Target Recalls Children's Two-Piece Pajama Sets Due to Violation of Federal Flammability Standard,2013-01,http://www.cpsc.gov/en/Recalls/2013/Target-Recalls-Childrens-Two-Piece-Pajama-Sets-Due-to-Violation-of-Federal-Flammability-Standard/,"[u'violation', u'children', u'federal', u'flammability', u'standard', u'sets']",Target Recalls Children's Two-Piece Pajama Sets Due to Violation of Federal Flammability Standard
2013-01-15,2013-01-15T12:00:00+00:00,"Tue, 15 Jan 2013 12:00:00 GMT",1358251200,"The fuel hose can develop small holes or cracks at the ends, allowing fuel to leak.",http://www.cpsc.gov/PageFiles/138385/13094_thumb.jpg,63,87,18da8a6b849b3e60f6f1b9f82d97bc1742657e18,"KTM North America Recalls Enduro Motorcycles Due to Fuel Leak, Fire and Crash Hazard",2013-01,http://www.cpsc.gov/en/Recalls/2013/KTM-North-America-Recalls-Enduro-Motorcycles-Due-to-Fuel-Leak-Fire-and-Crash-Hazard/,"[u'crash', u'fire', u'hazard']","KTM North America Recalls Enduro Motorcycles Due to Fuel Leak, Fire and Crash Hazard"
2013-01-15,2013-01-15T12:00:00+00:00,"Tue, 15 Jan 2013 12:00:00 GMT",1358251200,The carry handle on the Bugaboo Camelion and Bugaboo Donkey stollers can detach while in use. Bugaboo has received more than 50 reports of detaching handles.,http://www.cpsc.gov/PageFiles/138367/13092_thumb.jpg,63,87,f757a3af96d7def9a1efb404d75f7604e4567dd8,Bugaboo Recalls Strollers Due to Fall and Choking Hazards,2013-01,http://www.cpsc.gov/en/Recalls/2013/Bugaboo-Recalls-Strollers-Due-to-Fall-and-Choking-Hazards/,"[u'choking', u'hazards', u'fall']",Bugaboo Recalls Strollers Due to Fall and Choking Hazards
2013-01-10,2013-01-10T12:00:00+00:00,"Thu, 10 Jan 2013 12:00:00 GMT",1357819200,"Improper assembly of the vehicle's steering column to the rack and pinion can pose a risk of serious injury or death to the driver, passenger or bystanders.",http://www.cpsc.gov/PageFiles/138029/13718_thumb.jpg,63,87,0321b703a62722e6cc624437be356ca595582025,BRP Recalls Can-Am Side-By-Side Vehicles Due to Loss of Steering Control Hazard,2013-01,http://www.cpsc.gov/en/Recalls/2013/BRP-Recalls-Can-Am-Side-By-Side-Vehicles-Due-to-Loss-of-Steering-Control-Hazard/,"[u'vehicles', u'hazard']",BRP Recalls Can-Am Side-By-Side Vehicles Due to Loss of Steering Control Hazard
2013-01-10,2013-01-10T12:00:00+00:00,"Thu, 10 Jan 2013 12:00:00 GMT",1357819200,The fuel lines on John Deere Gator RSX850i utility vehicles can separate.,http://www.cpsc.gov/PageFiles/137997/13717_thumb.jpg,63,87,e60d09efdc7539f197a784d21d70b251626fccf5,John Deere Recalls Gator Utility Vehicles Due to Fire Hazard,2013-01,http://www.cpsc.gov/en/Recalls/2013/John-Deere-Recalls-Gator-Utility-Vehicles-Due-to-Fire-Hazard/,"[u'vehicles', u'fire', u'hazard']",John Deere Recalls Gator Utility Vehicles Due to Fire Hazard
2013-01-10,2013-01-10T12:00:00+00:00,"Thu, 10 Jan 2013 12:00:00 GMT",1357819200,"The diving hose that connects the regulator to the tank's pressure gauge can separate, reducing the available air supply to the diver. ",http://www.cpsc.gov/PageFiles/137961/13090_thumb.jpg,63,87,ced1c5405f7dd210e7384c4cf36f3edc5557097a,High-Pressure Scuba Diving Air Hoses Recalled by A-Plus Marine Due to Drowning Hazard,2013-01,http://www.cpsc.gov/en/Recalls/2013/High-Pressure-Scuba-Diving-Air-Hoses-Recalled-by-A-Plus-Marine-Due-to-Drowning-Hazard/,"[u'hazard', u'drowning', u'air']",High-Pressure Scuba Diving Air Hoses Recalled by A-Plus Marine Due to Drowning Hazard
2013-01-09,2013-01-09T12:00:00+00:00,"Wed, 09 Jan 2013 12:00:00 GMT",1357732800,The Lithium Polymer batteries used to power the jacket's heating system can overheat. ,http://www.cpsc.gov/PageFiles/137875/13089_thumb.jpg,63,87,88f82d291a1641569edaa9fd10692c257e5c51ee,Columbia Sportswear Reannounces Its Recall of Batteries Sold With Jackets Due To Fire Hazard,2013-01,http://www.cpsc.gov/en/Recalls/2013/Columbia-Sportswear-Reannounces-Its-Recall-of-Batteries-Sold-With-Jackets-Due-To-Fire-Hazard/,"[u'fire', u'sold', u'hazard']",Columbia Sportswear Reannounces Its Recall of Batteries Sold With Jackets Due To Fire Hazard
2013-01-09,2013-01-09T12:00:00+00:00,"Wed, 09 Jan 2013 12:00:00 GMT",1357732800,"The ROV's throttle can fail to work properly, which can cause the rider to lose control and crash.",http://www.cpsc.gov/PageFiles/137861/13716_thumb.jpg,63,87,8b68cf1ad3d2126b4d37e8fae2dd33229e28b646,Polaris Recalls Ranger Recreational Off-Highway Vehicles Due to Loss of Control and Crash Hazard,2013-01,http://www.cpsc.gov/en/Recalls/2013/Polaris-Recalls-Ranger-Recreational-Off-Highway-Vehicles-Due-to-Loss-of-Control-and-Crash-Hazard/,"[u'vehicles', u'crash', u'hazard']",Polaris Recalls Ranger Recreational Off-Highway Vehicles Due to Loss of Control and Crash Hazard
2013-01-08,2013-01-08T12:00:00+00:00,"Tue, 08 Jan 2013 12:00:00 GMT",1357646400,"The transformers, which are designed to power commercial signs, do not meet the UL standard for this product.",http://www.cpsc.gov/PageFiles/137781/13088_thumb.jpg,63,87,e79d2bb9f30938510ab837ab4e9941e980fd0e6b,PLATINUM Neon Sign Power Supply Transformers Made by HEICO lighting Recalled Due To Fire Hazard ,2013-01,http://www.cpsc.gov/en/Recalls/2013/PLATINUM-Neon-Sign-Power-Supply-Transformers-Made-by-HEICO-lighting-Recalled-Due-To-Fire-Hazard-/,"[u'fire', u'hazard']",PLATINUM Neon Sign Power Supply Transformers Made by HEICO lighting Recalled Due To Fire Hazard 
2013-01-08,2013-01-08T12:00:00+00:00,"Tue, 08 Jan 2013 12:00:00 GMT",1357646400,"Fisher-Price has received 600 reports of mold on the infant recliner seats. Sixteen consumers say their babies required treatment for respiratory issues, coughs and hives after sleeping in the product.",http://www.cpsc.gov/PageFiles/137687/13087_thumb.jpg,63,87,e438008b4b99e6692a0c599f4f26e79b6fc006f2,Fisher-Price Recalls to Inspect Rock ‘N Play Infant Sleepers Due to Risk of Exposure to Mold,2013-01,http://www.cpsc.gov/en/Recalls/2013/Fisher-Price-Recalls-to-Inspect-Rock-N-Play-Infant-Sleepers-Due-to-Risk-of-Exposure-to-Mold/,"[u'infant', u'risk']",Fisher-Price Recalls to Inspect Rock ‘N Play Infant Sleepers Due to Risk of Exposure to Mold
2013-01-04,2013-01-04T12:00:00+00:00,"Fri, 04 Jan 2013 12:00:00 GMT",1357300800,Installers and servicers could use undersized wiring due to wrong information on the unit's serial plate.,http://www.cpsc.gov/PageFiles/137496/13715_thumb.jpg,63,87,f5f1b821080b3d93250553195a354c593190c936,Goodman Company Recalls Amana Heating and Cooling Units Due to Fire Hazard,2013-01,http://www.cpsc.gov/en/Recalls/2013/Goodman-Company-Recalls-Amana-Heating-and-Cooling-Units-Due-to-Fire-Hazard/,"[u'fire', u'hazard']",Goodman Company Recalls Amana Heating and Cooling Units Due to Fire Hazard
2013-01-02,2013-01-02T12:00:00+00:00,"Wed, 02 Jan 2013 12:00:00 GMT",1357128000,The hooks attaching the cocking rope to the crossbow string can break and cause the rope to recoil and cut users.,http://www.cpsc.gov/PageFiles/137052/13086_thumb.jpg,63,87,4b3850bbabb9cb4697e63c27b50af06868701aca,Academy Sports + Outdoors Recalls Crossbow Cocking Ropes Due to Laceration Hazard,2013-01,http://www.cpsc.gov/en/Recalls/2013/Academy-Sports--Outdoors-Recalls-Crossbow-Cocking-Ropes-Due-to-Laceration-Hazard/,"[u'laceration', u'hazard']",Academy Sports + Outdoors Recalls Crossbow Cocking Ropes Due to Laceration Hazard
2013-01-02,2013-01-02T12:00:00+00:00,"Wed, 02 Jan 2013 12:00:00 GMT",1357128000,The base of the incubator can ignite during use.,http://www.cpsc.gov/PageFiles/136961/13085_thumb.jpg,63,87,7fb3ccdf689c0a68e87ba4ccb2862eead53ca2db,Brower Recalls Top Hatch Egg Incubators Due to Fire Hazard,2013-01,http://www.cpsc.gov/en/Recalls/2013/Brower-Recalls-Top-Hatch-Egg-Incubators-Due-to-Fire-Hazard/,"[u'fire', u'hazard']",Brower Recalls Top Hatch Egg Incubators Due to Fire Hazard
2012-12-27,2012-12-27T12:00:00+00:00,"Thu, 27 Dec 2012 12:00:00 GMT",1356609600,"Amazon, Buy, Buy, Baby, Diapers.com,Toys R Us/Babies R Us offer refunds or store credit for baby recliners they sold.",http://www.cpsc.gov/PageFiles/136634/13083_thumb.jpg,63,87,ed9f38a83d2a65d83aa9e211190ff777443c0b93,Four Retailers Agree to Stop Sale and Voluntarily Recall Nap Nanny Recliners Due to Five Infant Deaths,2012-12,http://www.cpsc.gov/en/Recalls/2013/Four-Retailers-Agree-to-Stop-Sale-and-Voluntarily-Recall-Nap-Nanny-Recliners-Due-to-Five-Infant-Deaths/,[u'infant'],Four Retailers Agree to Stop Sale and Voluntarily Recall Nap Nanny Recliners Due to Five Infant Deaths
2012-12-27,2012-12-27T12:00:00+00:00,"Thu, 27 Dec 2012 12:00:00 GMT",1356609600,The snap on the infant and toddler jeans can separate from the fabric.,http://www.cpsc.gov/PageFiles/136554/13084_thumb.jpg,63,87,5a8e94ed88ae748986990e74385631a5d5d103be,Meijer Recalls Falls Creek Kids Denim Jeans Due to Choking Hazard,2012-12,http://www.cpsc.gov/en/Recalls/2013/Meijer-Recalls-Falls-Creek-Kids-Denim-Jeans-Due-to-Choking-Hazard/,"[u'choking', u'hazard']",Meijer Recalls Falls Creek Kids Denim Jeans Due to Choking Hazard
2012-12-26,2012-12-26T10:30:00+00:00,"Wed, 26 Dec 2012 10:30:00 GMT",1356517800,"A weld on the ATV's front right and left upper suspension arms can separate, causing the driver to lose control of the vehicle, posing a crash hazard.",http://www.cpsc.gov/PageFiles/136225/13713_thumb.jpg,63,87,1f94ec2f104e3c70c7fd1a5241086b2b8d7da32e,American Honda Expands Recall of FourTrax ATVs Due to Crash Hazard,2012-12,http://www.cpsc.gov/en/Recalls/2013/American-Honda-Expands-Recall-of-FourTrax-ATVs-Due-to-Crash-Hazard/,"[u'crash', u'hazard']",American Honda Expands Recall of FourTrax ATVs Due to Crash Hazard
2012-12-26,2012-12-26T12:00:00+00:00,"Wed, 26 Dec 2012 12:00:00 GMT",1356523200,The artificially lit Christmas tree base can overheat.,http://www.cpsc.gov/PageFiles/136284/13714_thumb.jpg,63,87,6917b0efe03e8dd1b97ae40fb23347b89a04271a,Bethlehem Lights Recalls Christmas Trees Sold Exclusively by QVC Due to Fire Hazard,2012-12,http://www.cpsc.gov/en/Recalls/2013/Bethlehem-Lights-Recalls-Christmas-Trees-Sold-Exclusively-by-QVC-Due-to-Fire-Hazard/,"[u'exclusively', u'fire', u'sold', u'hazard']",Bethlehem Lights Recalls Christmas Trees Sold Exclusively by QVC Due to Fire Hazard
2012-12-20,2012-12-20T12:00:00+00:00,"Thu, 20 Dec 2012 12:00:00 GMT",1356004800,The presence of Aspergillus mold spores were discovered on the picture frames. The 2012 frames were sold at PAPYRUS Stores.,http://www.cpsc.gov/PageFiles/136065/13082_thumb.jpg,63,87,7f9bbe2f25bda90a1dba47cdb0d6c69e72e75833,PAPYRUS Signature Collection Frames Recalled Due to Risk of Exposure to Mold,2012-12,http://www.cpsc.gov/en/Recalls/2013/PAPYRUS-Signature-Collection-Frames-Recalled-Due-to-Risk-of-Exposure-to-Mold/,[u'risk'],PAPYRUS Signature Collection Frames Recalled Due to Risk of Exposure to Mold
